{
    "$schema": "https://json-schema.org/draft/2020-12/schema",
    "$id": "entry_response_schema.json",
    "$comment": "https://distributed-text-services.github.io/specifications/versions/1-alpha/#entry-endpoint",
    "type": "object",
    "properties": {
        "@context": {"type": "string"},
        "@id": {"type": "string"},
        "@type": {"type": "string"},
        "dtsVersion": {
            "type": "string",
            "enum": ["1-alpha", "unstable"]
        },
        "collection": {"type": "string"},
        "document": {"type": "string"},
        "navigation": {"type": "string"}
    },
    "required": [
        "@context", "@id", "@type", "dtsVersion", "collection", "document", "navigation"
    ]
}
